,sub_label,template,obj_label,masked_sentence
0,Yves Mirande,[X] is [Y] citizen .,France,"Yves Mirande (Bagneux (Maine-et-Loire), Mai 8, 1876 – Paris, March 17, 1957) was a [MASK] screenwriter, director, actor, and producer."
1,Yves Mirande,[X] is [Y] citizen .,France,"Yves Mirande (Bagneux (Maine-et-Loire), Mai 8, 1876 – Paris, March 17, 1957) was a [MASK] screenwriter, director, actor, and producer."
2,August Gailit,[X] is [Y] citizen .,Estonia,Sangaste is also the birthplace of the [MASK] writer August Gailit (1891-1960) and Estonian opera singer Aarne Viisimaa (1898-1989).
3,August Gailit,[X] is [Y] citizen .,Estonia,Sangaste is also the birthplace of the Estonian writer August Gailit (1891-1960) and [MASK] opera singer Aarne Viisimaa (1898-1989).
4,Princess Elisabeth of Denmark,[X] is [Y] citizen .,Denmark,"Princess Elisabeth of [MASK], RE (Elisabeth Caroline-Mathilde Alexandrine Helena Olga Thyra Feodora Estrid Margrethe Désirée; born 8 May 1935 in Copenhagen) is the daughter of Hereditary Prince Knud and Hereditary Princess Caroline-Mathilde of Denmark, and is a first cousin of the present Danish monarch, Queen Margrethe II."
5,Princess Elisabeth of Denmark,[X] is [Y] citizen .,Denmark,"Princess Elisabeth of Denmark, RE (Elisabeth Caroline-Mathilde Alexandrine Helena Olga Thyra Feodora Estrid Margrethe Désirée; born 8 May 1935 in Copenhagen) is the daughter of Hereditary Prince Knud and Hereditary Princess Caroline-Mathilde of [MASK], and is a first cousin of the present Danish monarch, Queen Margrethe II."
6,Tue West,[X] is [Y] citizen .,Denmark,Tue West (born 1977) is a [MASK] composer.
7,Tue West,[X] is [Y] citizen .,Denmark,Tue West (born 1977) is a [MASK] composer.
8,Bertil Lindblad,[X] is [Y] citizen .,Sweden,"Bertil Lindblad (Örebro, 26 November 1895 – Saltsjöbaden, outside Stockholm, 25 June 1965) was a [MASK] astronomer."
9,Bertil Lindblad,[X] is [Y] citizen .,Sweden,"Bertil Lindblad (Örebro, 26 November 1895 – Saltsjöbaden, outside Stockholm, 25 June 1965) was a [MASK] astronomer."
10,Prafulla Chandra Ghosh,[X] is [Y] citizen .,India,"Prafulla Chandra Ghosh (Bengali: প্রফুল্ল চন্দ্র ঘোষ Prophullo Chôndro Ghosh) (1891–1983) was the first Chief Minister of West Bengal, [MASK]."
11,Prafulla Chandra Ghosh,[X] is [Y] citizen .,India,"Prafulla Chandra Ghosh (Bengali: প্রফুল্ল চন্দ্র ঘোষ Prophullo Chôndro Ghosh) (1891–1983) was the first Chief Minister of West Bengal, [MASK]."
12,Noriyasu Hirata,[X] is [Y] citizen .,Japan,"Noriyasu Hirata (平田 典靖 Hirata Noriyasu, born November 17, 1983) is a badminton player from [MASK]."
13,Noriyasu Hirata,[X] is [Y] citizen .,Japan,"Noriyasu Hirata (平田 典靖 Hirata Noriyasu, born November 17, 1983) is a badminton player from [MASK]."
14,Woodrow Lloyd,[X] is [Y] citizen .,Canada,"After Douglas left to lead the federal NDP in 1961, Woodrow Lloyd became premier and the first universal medical care plan in [MASK] was introduced."
15,Woodrow Lloyd,[X] is [Y] citizen .,Canada,"Bastedo employed the little-used power to reserve a bill (that is, withhold assent and send the bill to the Governor General of [MASK] who would grant assent only if the federal Cabinet agrees) proposed by Saskatchewan's Co-operative Commonwealth Federation government of Woodrow Lloyd in 1961."
16,Namadi Sambo,[X] is [Y] citizen .,Nigeria,Mohammed Namadi Sambo (born 2 August 1954) is a Nigerian politician who was Vice President of [MASK] from 19 May 2010 to 29 May 2015.
17,Namadi Sambo,[X] is [Y] citizen .,Nigeria,Mohammed Namadi Sambo (born 2 August 1954) is a Nigerian politician who was Vice President of [MASK] from 19 May 2010 to 29 May 2015.
18,Leif Sylvester Petersen,[X] is [Y] citizen .,Denmark,"Leif Sylvester Petersen, (born 18 April 1940) in Copenhagen, also known as Leif Sylvester, is a [MASK] painter, graphic artist, musician and actor."
19,Leif Sylvester Petersen,[X] is [Y] citizen .,Denmark,"Leif Sylvester Petersen, (born 18 April 1940) in Copenhagen, also known as Leif Sylvester, is a [MASK] painter, graphic artist, musician and actor."
20,John Landy,[X] is [Y] citizen .,Australia,"At the conclusion of the 1956 Melbourne Olympic Games, the Geelong City Council held a dinner on 15 January 1957 to honour the six Geelong Guild athletes (Ron Blackney, John Chittick, Robert James ""Bob"" Joyce, John Landy, Don MacMillan and John Vernon) who had represented Geelong and [MASK] at these games."
21,John Landy,[X] is [Y] citizen .,Australia,"During the dinner, where most of the neighbouring Cities and Shires were represented, John Landy made a speech on behalf of the honoured athletes, in which Landy compared overseas facilities available to athletes to those of [MASK]."
22,H. V. Evatt,[X] is [Y] citizen .,Australia,"Elizabeth Andreas Evatt, AC (born 11 November 1933), an eminent Australian reformist lawyer and jurist who sat on numerous national and international tribunals and commissions, was the first Chief Judge of the Family Court of [MASK], the first female judge of an Australian federal court, and the first Australian to be elected to the United Nations Human Rights Committee."
23,H. V. Evatt,[X] is [Y] citizen .,Australia,The incumbent Liberal Party of [MASK] led by Prime Minister of Australia Robert Menzies with coalition partner the Country Party led by Arthur Fadden defeated the Australian Labor Party led by Herbert Evatt.
24,"Humphrey Stafford, 1st Duke of Buckingham",[X] is [Y] citizen .,England,"Humphrey Stafford, 1st Duke of Buckingham (15 August 1402 – 10 July 1460) was an [MASK] nobleman."
25,"Humphrey Stafford, 1st Duke of Buckingham",[X] is [Y] citizen .,England,"Humphrey Stafford, 1st Duke of Buckingham (15 August 1402 – 10 July 1460) was an [MASK] nobleman."
26,Thomas Bo Larsen,[X] is [Y] citizen .,Denmark,"Thomas Bo Larsen (born 27 November 1963) is a [MASK] film actor, born in Gladsaxe, Denmark."
27,Thomas Bo Larsen,[X] is [Y] citizen .,Denmark,"Thomas Bo Larsen (born 27 November 1963) is a Danish film actor, born in Gladsaxe, [MASK]."
28,Daniela Iraschko-Stolz,[X] is [Y] citizen .,Austria,"[MASK] dominated the ski jumping, winning all five events: Thomas Morgenstern took three golds and one silver, Gregor Schlierenzauer won three golds, and Daniela Iraschko won the women's event."
29,Daniela Iraschko-Stolz,[X] is [Y] citizen .,Austria,In ladies' World cup Daniela Iraschko-Stolz won her first overall title and [MASK] won their first Nations cup.
30,Mari Hamada,[X] is [Y] citizen .,Japan,"Mari Hamada (濱田マリ Hamada Mari, born December 27, 1968 at Kobe, Hyogo, [MASK]) is a Japanese singer and actress who starred in numerous movies and drama in Japan and released two solo albums and solo singles in the 1990s, after being part of the Japanese band ""Modern Choki Chokies""."
31,Mari Hamada,[X] is [Y] citizen .,Japan,"Mari Hamada (濱田マリ Hamada Mari, born December 27, 1968 at Kobe, Hyogo, Japan) is a Japanese singer and actress who starred in numerous movies and drama in [MASK] and released two solo albums and solo singles in the 1990s, after being part of the Japanese band ""Modern Choki Chokies""."
32,Arturo Rodas,[X] is [Y] citizen .,Ecuador,Arturo Rodas (3 March 1954 in Quito) is an [MASK] French-citizen composer.
33,Arturo Rodas,[X] is [Y] citizen .,Ecuador,Arturo Rodas (3 March 1954 in Quito) is an [MASK] French-citizen composer.
34,Enrique Llanes,[X] is [Y] citizen .,Mexico,"Enrique Juan Yañez González (August 24, 1919 – September 18, 2004), best known under the ring name Enrique Llanes, was one of the premier Hispanic professional wrestlers in the early days of Lucha Libre when most wrestlers were imported from outside of [MASK]."
35,Enrique Llanes,[X] is [Y] citizen .,Mexico,"Enrique Juan Yañez González (August 24, 1919 – September 18, 2004), best known under the ring name Enrique Llanes, was one of the premier Hispanic professional wrestlers in the early days of Lucha Libre when most wrestlers were imported from outside of [MASK]."
36,Lionel Messi,[X] is [Y] citizen .,Argentina,"Eduardo Messi, president of Nucleoeléctrica [MASK] S.A."
37,Lionel Messi,[X] is [Y] citizen .,Argentina,"Born and raised in central [MASK], Messi was diagnosed with a growth hormone deficiency as a child."
38,Diosdado Cabello,[X] is [Y] citizen .,Venezuela,"Diosdado Cabello Rondón (born 15 April 1963) is a Venezuelan politician, member of the National Assembly of [MASK] and a former Speaker of the country's legislature, and active member of the Venezuelan armed forces."
39,Diosdado Cabello,[X] is [Y] citizen .,Venezuela,"Diosdado Cabello Rondón (born 15 April 1963) is a Venezuelan politician, member of the National Assembly of [MASK] and a former Speaker of the country's legislature, and active member of the Venezuelan armed forces."
40,Ken Okuyama,[X] is [Y] citizen .,Japan,His given name is Kiyoyuki Okuyama (奥山 清行 Okuyama Kiyoyuki) but goes by Ken Okuyama (ケン・オクヤマ) outside [MASK].
41,Ken Okuyama,[X] is [Y] citizen .,Japan,His given name is Kiyoyuki Okuyama (奥山 清行 Okuyama Kiyoyuki) but goes by Ken Okuyama (ケン・オクヤマ) outside [MASK].
42,Andrew Bogut,[X] is [Y] citizen .,Australia,"Virgin Islands) in 1997, Michael Olowokandi (Nigeria) in 1998, Andrew Bogut ([MASK]) in 2005, Kyrie Irving (Australia) in 2011, Anthony Bennett (Canada) in 2013, Andrew Wiggins (Canada) in 2014, and Karl-Anthony Towns (Dominican Republic) in 2015."
43,Andrew Bogut,[X] is [Y] citizen .,Australia,"Virgin Islands) in 1997, Michael Olowokandi (Nigeria) in 1998, Andrew Bogut (Australia) in 2005, Kyrie Irving ([MASK]) in 2011, Anthony Bennett (Canada) in 2013, Andrew Wiggins (Canada) in 2014, and Karl-Anthony Towns (Dominican Republic) in 2015."
44,Juma Ikangaa,[X] is [Y] citizen .,Tanzania,"He came second in the 1989 New York City Marathon in 2:09:38 to [MASK]’s Juma Ikangaa’s 2:08:01; as of 2007, that was the fourth-fastest marathon time by an American-born athlete."
45,Juma Ikangaa,[X] is [Y] citizen .,Tanzania,"Juma Ikangaa (born July 19, 1957 in Dodoma) is a marathon runner from [MASK], a sentimental favorite in Boston after finishing second three years in a row at the Boston Marathon from 1988-1990."
46,Marlene Favela,[X] is [Y] citizen .,Mexico,"Marlene Favela (born Silvia Marlene Favela Meraz on August 5, 1976 in Santiago Papasquiaro, Durango, [MASK]) is a Mexican actress."
47,Marlene Favela,[X] is [Y] citizen .,Mexico,"Marlene Favela (born Silvia Marlene Favela Meraz on August 5, 1976 in Santiago Papasquiaro, Durango, Mexico) is a [MASK] actress."
48,Abdul Khalid Ibrahim,[X] is [Y] citizen .,Malaysia,He was a Member of Parliament of (P124) Bandar Tun Razak in Wilayah Persekutuan (Federal Territory) of [MASK]) representing the National Front Coalition (Barisan Nasional) for 3 terms until he lost to Tan Sri Abdul Khalid Ibrahim of Parti Keadilan Rakyat (PKR) in the twelfth General Election in Malaysia on 8 March 2008.
49,Abdul Khalid Ibrahim,[X] is [Y] citizen .,Malaysia,He was a Member of Parliament of (P124) Bandar Tun Razak in Wilayah Persekutuan (Federal Territory) of Malaysia) representing the National Front Coalition (Barisan Nasional) for 3 terms until he lost to Tan Sri Abdul Khalid Ibrahim of Parti Keadilan Rakyat (PKR) in the twelfth General Election in [MASK] on 8 March 2008.
50,Prince Leka of Albania,[X] is [Y] citizen .,Albania,"Prince Leka of [MASK] (Leka Anwar Zog Reza Baudouin Msiziwe Zogu, born 26 March 1982) is the only child of Leka, Crown Prince of Albania and Susan Cullen-Ward."
51,Prince Leka of Albania,[X] is [Y] citizen .,Albania,"Prince Leka of Albania (Leka Anwar Zog Reza Baudouin Msiziwe Zogu, born 26 March 1982) is the only child of Leka, Crown Prince of [MASK] and Susan Cullen-Ward."
52,Auguste Forel,[X] is [Y] citizen .,Switzerland,"Other famous students of Meynert's were Russian neuropsychiatrist Sergei Korsakoff (1854–1900), German neuropathologist Carl Wernicke (1848–1905) and [MASK] neuroanatomist Auguste-Henri Forel (1848–1931)."
53,Auguste Forel,[X] is [Y] citizen .,Switzerland,"Forel is a letter of `Abdu'l-Bahá, written in reply to questions asked by Auguste-Henri Forel, a [MASK] myrmecologist, neuroanatomist and psychiatrist."
54,Alfred Werner,[X] is [Y] citizen .,Switzerland,Alfred Werner (12 December 1866 – 15 November 1919) was a [MASK] chemist who was a student at ETH Zurich and a professor at the University of Zurich.
55,Alfred Werner,[X] is [Y] citizen .,Switzerland,Alfred Werner (12 December 1866 – 15 November 1919) was a [MASK] chemist who was a student at ETH Zurich and a professor at the University of Zurich.
56,Szymon Szymonowic,[X] is [Y] citizen .,Poland,"Zimorowic acknowledges the most important earlier [MASK] pastoral poet Szymon Szymonowic, whose Sielanki appeared in 1614, as his master, but his own poems are notable for their local, ""Ruthenian"" (i.e."
57,Szymon Szymonowic,[X] is [Y] citizen .,Poland,"He also corresponded with the [MASK] poet Szymon Szymonowic, and other Polish connections included his stay at the University of Altdorf 1614-1616 at the same time as the Socinian activity there around Samuel Przypkowski."
58,Rosario Flores,[X] is [Y] citizen .,Spain,"Previously, his own band has featured an international mix of musicians – Perico Sambeat (alto saxophone; [MASK]), Bernardo Sassetti (piano; Portugal), Geoff Gascoyne (bass, United Kingdom), and Gene Calderazzo (drums; United States) More recently he has toured the Guy Barker Jazz Orchestra – a 15 piece big band featuring Rosario Giuliani (alto saxophone; Italy) and Per Johansson (tenor saxophone; Sweden) - performing DZF, a reworking of Mozart's Magic Flute with Michael Brandon narrating the story as a Raymond Chandler style pulp fiction novel, retold by Robert Ryan Guy Barker was Musical Director / Arranger for the opening gala concert ""Jazz Voice : Celebrating a century of song"" at the London Jazz Festival annually from 2008 to 2014."
59,Rosario Flores,[X] is [Y] citizen .,Spain,"Princess Maria de la Esperanza Amalia Raniera Maria Rosario Luisa Gonzaga of Bourbon-Two Sicilies (14 June 1914, Madrid, [MASK] – 8 August 2005, Villamanrique de la Condesa, Spain) was the youngest daughter of Prince Carlos of Bourbon-Two Sicilies and his wife Princess Louise of Orléans."
60,Inge Magnusson,[X] is [Y] citizen .,Norway,Inge Magnusson or Inge Baglar-king was from 1196 to 1202 the Bagler candidate for pretender to the Norwegian throne during the Civil war era in [MASK].
61,Inge Magnusson,[X] is [Y] citizen .,Norway,Inge Magnusson or Inge Baglar-king was from 1196 to 1202 the Bagler candidate for pretender to the Norwegian throne during the Civil war era in [MASK].
62,Eleanor Wachtel,[X] is [Y] citizen .,Canada,"Journalist Eleanor Wachtel describes a major problem faced by feminist magazines and journals in [MASK] in her 1983 report on Feminist Print Media as involving ""a small population stretched out across 4000 miles""."
63,Eleanor Wachtel,[X] is [Y] citizen .,Canada,"Hosted by Eleanor Wachtel, the program covered theatre, dance, books, music and visual arts in [MASK] in a magazine and interview format."
64,Charles II of Spain,[X] is [Y] citizen .,Spain,"Claude Lamoral, 3rd Prince of Ligne, Prince of Epinoy, Marquis of Roubaix and Count of Fauquemberg (8 October 1618 – 21 December 1679), was a nobleman from the Spanish Netherlands, military and diplomate in the service of Philip IV of [MASK] and Charles II of Spain ."
65,Charles II of Spain,[X] is [Y] citizen .,Spain,"Claude Lamoral, 3rd Prince of Ligne, Prince of Epinoy, Marquis of Roubaix and Count of Fauquemberg (8 October 1618 – 21 December 1679), was a nobleman from the Spanish Netherlands, military and diplomate in the service of Philip IV of Spain and Charles II of [MASK] ."
66,Jean Baptiste Abbeloos,[X] is [Y] citizen .,Belgium,"Quadrophonia were a Dutch/[MASK] electronic music collective, formed by Olivier Abbeloos (also known as part of T99) and Lucien Foort in the late 1980s, with several of their tracks performed by Marvin D (Marvin Tholen)."
67,Jean Baptiste Abbeloos,[X] is [Y] citizen .,Belgium,Jean Baptiste Abbeloos (15 January 1836 – 25 February 1906) was a [MASK] orientalist and Rector of the University of Leuven.
68,Timothy Anglin,[X] is [Y] citizen .,Canada,"Timothy Warren Anglin (August 31, 1822 – May 4, 1896) was a [MASK] politician and Speaker of the Canadian House of Commons."
69,Timothy Anglin,[X] is [Y] citizen .,Canada,"Timothy Warren Anglin (August 31, 1822 – May 4, 1896) was a Canadian politician and Speaker of the [MASK] House of Commons."
70,Hanan al-Shaykh,[X] is [Y] citizen .,Lebanon,"She has translated numerous literary works from Arabic to English, including several by the [MASK] author Hanan al-Shaykh."
71,Hanan al-Shaykh,[X] is [Y] citizen .,Lebanon,"Hanan al-Shaykh (born November 12, 1945, Beirut) is a [MASK] author of contemporary literature."
72,Art mac Cuinn,[X] is [Y] citizen .,Ireland,"Art mac Cuinn (""son of Conn""), also known as Art Óenfer (literally ""one man"", used in the sense of ""lone"", ""solitary"", or ""only son""), was, according to medieval Irish legend and historical tradition, a High King of [MASK]."
73,Art mac Cuinn,[X] is [Y] citizen .,Ireland,"Art mac Cuinn (""son of Conn""), also known as Art Óenfer (literally ""one man"", used in the sense of ""lone"", ""solitary"", or ""only son""), was, according to medieval Irish legend and historical tradition, a High King of [MASK]."
74,Ely Guerra,[X] is [Y] citizen .,Mexico,"Ely Guerra (born Elizabeth Guerra Vázquez, February 13, 1972) is a Mexican singer-songwriter who was raised in Monterrey, Nuevo Leon, [MASK]."
75,Ely Guerra,[X] is [Y] citizen .,Mexico,"Ely Guerra (born Elizabeth Guerra Vázquez, February 13, 1972) is a Mexican singer-songwriter who was raised in Monterrey, Nuevo Leon, [MASK]."
76,Felix Plater,[X] is [Y] citizen .,Switzerland,"Felix Plater (or Platter) (October 28, 1536 – July 28, 1614) was a [MASK] physician, professor in Basel, well known for his classification of psychiatric diseases, and was also the first to describe an intracranial tumour (a meningioma)."
77,Felix Plater,[X] is [Y] citizen .,Switzerland,"Felix Plater (or Platter) (October 28, 1536 – July 28, 1614) was a [MASK] physician, professor in Basel, well known for his classification of psychiatric diseases, and was also the first to describe an intracranial tumour (a meningioma)."
78,Borys Kolesnikov,[X] is [Y] citizen .,Ukraine,"Borys Kolesnikov, a prominent Ukrainian politician and businessman, purchased the team in 2010, and from then until 2014 it was the most successful hockey club in [MASK]."
79,Borys Kolesnikov,[X] is [Y] citizen .,Ukraine,"Borys Kolesnikov, a prominent Ukrainian politician and businessman, purchased the team in 2010, and since this time the organization has become the most successful in [MASK]."
80,Assif Tsahar,[X] is [Y] citizen .,Israel,"Assif Tsahar (born [MASK], June 11, 1969) is an Israeli tenor saxophonist and bass clarinetist."
81,Assif Tsahar,[X] is [Y] citizen .,Israel,"Assif Tsahar (born [MASK], June 11, 1969) is an Israeli tenor saxophonist and bass clarinetist."
82,Marek Niit,[X] is [Y] citizen .,Estonia,"Marek Niit (born August 9, 1987 in Kuressaare) is a male sprinter from [MASK] who won gold medal at the 200 metres at the 2006 World Junior Championships in Athletics in Beijing, China."
83,Marek Niit,[X] is [Y] citizen .,Estonia,"Marek Niit (born August 9, 1987 in Kuressaare) is a male sprinter from [MASK] who won gold medal at the 200 metres at the 2006 World Junior Championships in Athletics in Beijing, China."
84,Marcel Trudel,[X] is [Y] citizen .,Canada,"Marcel Trudel, CC GOQ (May 29, 1917 – January 11, 2011) was a [MASK] historian, university professor (1947–1982) and author who published more than 40 books on the history of New France, scientifically re-written."
85,Marcel Trudel,[X] is [Y] citizen .,Canada,"Marcel Trudel, CC GOQ (May 29, 1917 – January 11, 2011) was a [MASK] historian, university professor (1947–1982) and author who published more than 40 books on the history of New France, scientifically re-written."
86,Fa Ngum,[X] is [Y] citizen .,Laos,":225–226 In 1359 the Khmer king gave the Phra Bang to his son-in-law, the first Lang Xang monarch Fa Ngum (1353-1373); to provide Buddhist legitimacy both to Fa Ngum's rule and by extension to the sovereignty of [MASK]."
87,Fa Ngum,[X] is [Y] citizen .,Laos,":225–226 In 1359 the Khmer king gave the Phra Bang to his son-in-law, the first Lang Xang monarch Fa Ngum (1353-1373); to provide Buddhist legitimacy both to Fa Ngum's rule and by extension to the sovereignty of [MASK]."
88,Lyuben Berov,[X] is [Y] citizen .,Bulgaria,"Stoyan Alexandrov ([MASK]: Стоян Александров, born 14 June 1949 in Iliya, Kystendil) is a Bulgarian economist, and former Minister of Finance under Prime Minister Lyuben Berov."
89,Lyuben Berov,[X] is [Y] citizen .,Bulgaria,"Stoyan Alexandrov (Bulgarian: Стоян Александров, born 14 June 1949 in Iliya, Kystendil) is a [MASK] economist, and former Minister of Finance under Prime Minister Lyuben Berov."
90,Colman mac Duagh,[X] is [Y] citizen .,Ireland,"Saint Colman mac Duagh was born at Cork, Kiltartan, County Galway, [MASK], (c."
91,Colman mac Duagh,[X] is [Y] citizen .,Ireland,"Saint Colman mac Duagh was born at Cork, Kiltartan, County Galway, [MASK], (c."
92,"Frank Oberle, Sr.",[X] is [Y] citizen .,Canada,"Frank Oberle, Sr., PC (born March 24, 1932) is a businessman and former [MASK] politician."
93,"Frank Oberle, Sr.",[X] is [Y] citizen .,Canada,"Frank Oberle, Sr., PC (born March 24, 1932) is a businessman and former [MASK] politician."
94,Mario Aerts,[X] is [Y] citizen .,Belgium,"Mario Aerts (born 31 December 1974 in Herentals, [MASK]) is a former professional road bicycle racer, who competed between 1996 and 2011."
95,Mario Aerts,[X] is [Y] citizen .,Belgium,"Mario Aerts (born 31 December 1974 in Herentals, [MASK]) is a former professional road bicycle racer, who competed between 1996 and 2011."
96,Abdul Malik Pahlawan,[X] is [Y] citizen .,Afghanistan,Abdul Malik Pahlawan is an Uzbek politician based in Faryab Province in northern [MASK].
97,Abdul Malik Pahlawan,[X] is [Y] citizen .,Afghanistan,Abdul Malik Pahlawan is an Uzbek politician based in Faryab Province in northern [MASK].
98,Gorm the Old,[X] is [Y] citizen .,Denmark,"The legendary kings of [MASK] are the predecessors of Gorm the Old, half history and half legend."
99,Gorm the Old,[X] is [Y] citizen .,Denmark,"Gorm the Old (Danish: Gorm den Gamle, Old Norse: Gormr gamli, Latin: Gormus Vetus), also called Gorm the Languid (Danish: Gorm Løge, Gorm den Dvaske), was the first historically recognized King of [MASK], reigning from c."
100,Gabriel Garcete,[X] is [Y] citizen .,Paraguay,"Gabriel Garcete Jimenez (born 7 January 1982 in Yegros, [MASK]) isa Paraguayan footballer."
101,Gabriel Garcete,[X] is [Y] citizen .,Paraguay,"Gabriel Garcete Jimenez (born 7 January 1982 in Yegros, [MASK]) isa Paraguayan footballer."
102,Arthur Phillip,[X] is [Y] citizen .,Australia,"Admiral Arthur Phillip RN (11 October 1738 – 31 August 1814) was a Royal Navy officer, the first Governor of New South Wales and led the colonisation of what is now [MASK] and founded the British penal colony that later became the city of Sydney, Australia."
103,Arthur Phillip,[X] is [Y] citizen .,Australia,"Admiral Arthur Phillip RN (11 October 1738 – 31 August 1814) was a Royal Navy officer, the first Governor of New South Wales and led the colonisation of what is now [MASK] and founded the British penal colony that later became the city of Sydney, Australia."
104,Johann Aegidius Bach,[X] is [Y] citizen .,Germany,"Johann Aegidius Bach (9 February 1645 – November 1716) was organist, violist, and municipal orchestra director of Erfurt, [MASK]."
105,Johann Aegidius Bach,[X] is [Y] citizen .,Germany,"Johann Aegidius Bach (9 February 1645 – November 1716) was organist, violist, and municipal orchestra director of Erfurt, [MASK]."
106,Katsuhiko Nagata,[X] is [Y] citizen .,Japan,"Katsuhiko Nagata (永田克彦 Nagata Katsuhiko, born on October 31, 1973 in Tōgane, Chiba, [MASK]) is a Japanese olympic wrestler and mixed martial artist, who won the silver medal in 63–69 kg Greco-Roman wrestling at the 2000 Summer Olympics."
107,Katsuhiko Nagata,[X] is [Y] citizen .,Japan,"Katsuhiko Nagata (永田克彦 Nagata Katsuhiko, born on October 31, 1973 in Tōgane, Chiba, [MASK]) is a Japanese olympic wrestler and mixed martial artist, who won the silver medal in 63–69 kg Greco-Roman wrestling at the 2000 Summer Olympics."
108,Katerine Moreno,[X] is [Y] citizen .,Bolivia,Katerine Moreno de Quintanilla (born 4 May 1974 in Santa Cruz de la Sierra) is a retired swimmer from [MASK].
109,Katerine Moreno,[X] is [Y] citizen .,Bolivia,Katerine Moreno de Quintanilla (born 4 May 1974 in Santa Cruz de la Sierra) is a retired swimmer from [MASK].
110,Yuki Uchida,[X] is [Y] citizen .,Japan,"Junjou Karen Otome Moyou (純情可憐乙女模様) is Yuki Uchida's first album, released in [MASK] on 1995/02/08 on King Records label (reference: KICS-470)."
111,Yuki Uchida,[X] is [Y] citizen .,Japan,"Mi-Chemin is Yuki Uchida's 2nd album, released in [MASK] on 1995/09/21 on King Records label (reference: KICS-510)."
112,Joan Burton,[X] is [Y] citizen .,Ireland,"Following the Irish general election, 2011 and a re-shuffle in 2014, four women were appointed cabinet ministers (the highest number of women in senior ministerial positions ever in [MASK]): Joan Burton, Frances Fitzgerald, Jan O'Sullivan and Heather Humphries."
