,sub_label,template,obj_label,masked_sentence
1035,Mahito Tsujimura,[X] is [Y] citizen .,Japan,"Mahito Tsujimura (辻村 真人 Tsujimura Mahito, born April 14, 1930 in Tokyo, [MASK]) is a Japanese voice actor employed by 81 Produce."
1036,Abolfazl Jalili,[X] is [Y] citizen .,Iran,"Abolfazl Jalili (Persian: ابوالفضل جلیلی , born 1957 in Saveh, [MASK]) is an internationally acclaimed Iranian film director."
1037,Abolfazl Jalili,[X] is [Y] citizen .,Iran,"Abolfazl Jalili (Persian: ابوالفضل جلیلی , born 1957 in Saveh, [MASK]) is an internationally acclaimed Iranian film director."
1038,Mahmoud Fawzi,[X] is [Y] citizen .,Egypt,"Mahmoud Fawzi (Arabic: محمود فوزى, [mæħˈmuːd ˈfæwzi]) (19 September 1900 – 12 June 1981) was an Egyptian diplomat and political figure of Circassian origin who was Prime Minister of [MASK] from 1970-1972 and Vice President of Egypt from 1972-1974."
1039,Mahmoud Fawzi,[X] is [Y] citizen .,Egypt,"Mahmoud Fawzi (Arabic: محمود فوزى, [mæħˈmuːd ˈfæwzi]) (19 September 1900 – 12 June 1981) was an Egyptian diplomat and political figure of Circassian origin who was Prime Minister of Egypt from 1970-1972 and Vice President of [MASK] from 1972-1974."
1040,Ferdinand Meldahl,[X] is [Y] citizen .,Denmark,Ferdinand Meldahl (16 March 1827 – 3 February 1908) was a [MASK] architect best known for the reconstruction of Frederiksborg Castle after the fire in 1859.
1041,Ferdinand Meldahl,[X] is [Y] citizen .,Denmark,Ferdinand Meldahl (16 March 1827 – 3 February 1908) was a [MASK] architect best known for the reconstruction of Frederiksborg Castle after the fire in 1859.
1042,Arnold Clavio,[X] is [Y] citizen .,Philippines,"Arnold Clavio (born November 2, 1965 in Tondo, Manila), also called Igan, is a radio and television newscaster, journalist, and television host in the [MASK]."
1043,Arnold Clavio,[X] is [Y] citizen .,Philippines,"Arnold Clavio (born November 2, 1965 in Tondo, Manila), also called Igan, is a radio and television newscaster, journalist, and television host in the [MASK]."
1044,Kazimierz Nycz,[X] is [Y] citizen .,Poland,"Kazimierz Nycz (born 1 February 1950) is a [MASK] prelate, a Cardinal of the Roman Catholic Church."
1045,Kazimierz Nycz,[X] is [Y] citizen .,Poland,"Kazimierz Nycz (born 1 February 1950) is a [MASK] prelate, a Cardinal of the Roman Catholic Church."
1046,Brian O'Nolan,[X] is [Y] citizen .,Ireland,"271), and it has been republished several times in [MASK], Britain and the United States, both as a stand-alone work and, most recently, in Flann O'Brien: The Complete Novels (Everyman's Library, 2007)."
1047,Brian O'Nolan,[X] is [Y] citizen .,Ireland,"The list of contributors to The Bell included many of [MASK]'s foremost writers, among them Patrick Kavanagh, Patrick Swift, Flann O'Brien, Frank O'Connor and Brendan Behan."
1048,Priyanandanan,[X] is [Y] citizen .,India,"Priyanandanan is a film and drama director from Kerala, [MASK]."
1049,Priyanandanan,[X] is [Y] citizen .,India,"Priyanandanan is a film and drama director from Kerala, [MASK]."
1050,Andrei Soldatov,[X] is [Y] citizen .,Russia,"Hatcher gained notoriety in August 2009 after the Russian tabloid Komsomolskaya Pravda, a newspaper which Russian intelligence expert Andrei Soldatov ties to the Federal Security Services (FSB) of the [MASK], showed a fake video of him while accusing him of being an undercover CIA agent in Russia."
1051,Andrei Soldatov,[X] is [Y] citizen .,Russia,"Hatcher gained notoriety in August 2009 after the Russian tabloid Komsomolskaya Pravda, a newspaper which Russian intelligence expert Andrei Soldatov ties to the Federal Security Services (FSB) of the Russian Federation, showed a fake video of him while accusing him of being an undercover CIA agent in [MASK]."
1052,Giovanni Juan Ignazio Molina,[X] is [Y] citizen .,Chile,"Guaraculén was the birthplace of the famed Jesuit Priest, naturalist and cronist Juan Ignacio Molina (Abate Molina), who was forced to leave [MASK] in 1768 when the Jesuits were expelled."
1053,Giovanni Juan Ignazio Molina,[X] is [Y] citizen .,Chile,"The malón among the Mapuche is described as a means of obtaining justice by Juan Ignacio Molina: As a tactic against the Spanish, the malón, pioneered by leaders such as Lientur, consisted of a fast surprise attack by a number of mounted Mapuche warriors against the white (huinca) populations, haciendas, settlements and fortifications in [MASK] and Argentina, with the aim of obtaining horses, cattle, provisions and captives, often young women."
1054,Pisharoth Rama Pisharoty,[X] is [Y] citizen .,India,"Pisharoth Rama Pisharoty (Malayalam: പിഷാരത്ത് രാമ പിഷാരടി;February 10, 1909 – September 24, 2002) was an Indian physicist and meteorologist, and is considered to be the father of remote sensing in [MASK]."
1055,Pisharoth Rama Pisharoty,[X] is [Y] citizen .,India,"Pisharoth Rama Pisharoty (Malayalam: പിഷാരത്ത് രാമ പിഷാരടി;February 10, 1909 – September 24, 2002) was an Indian physicist and meteorologist, and is considered to be the father of remote sensing in [MASK]."
1056,Amanz Gressly,[X] is [Y] citizen .,Switzerland,Amanz Gressly (17 July 1814 – 13 April 1865) was a [MASK] geologist and paleontologist.
1057,Amanz Gressly,[X] is [Y] citizen .,Switzerland,Amanz Gressly (17 July 1814 – 13 April 1865) was a [MASK] geologist and paleontologist.
1058,Arvid Lindman,[X] is [Y] citizen .,Sweden,"In 1934, Arvid Lindman, the leader of the Moderate Party, declared that the National Youth League of [MASK] (Sveriges nationella ungdomsförbund, SNU) no longer was considered the official youth organisation of the Swedish right due to its pro-Nazi stance."
1059,Arvid Lindman,[X] is [Y] citizen .,Sweden,"In 1934, Arvid Lindman, the leader of the Moderate Party, declared that the National Youth League of Sweden (Sveriges nationella ungdomsförbund, SNU) no longer was considered the official youth organisation of the [MASK] right due to its pro-Nazi stance."
1060,Lefteris Papadopoulos,[X] is [Y] citizen .,Greece,It was released in 1991 by the WEA [MASK] and is composed by Christos Nikolopoulos and Lefteris Papadopoulos.
1061,Lefteris Papadopoulos,[X] is [Y] citizen .,Greece,"According to lyricist Lefteris Papadopoulos, Kouyioumtzis ""followed the music spirit which was dominant in [MASK] during the last 25 years (from 1965 to 1990) through the music of Mikis Theodorakis and Manos Hadjidakis""."
1062,Jorge Enrique Abello,[X] is [Y] citizen .,Colombia,"Jorge Enrique Abello, born February 28, 1968 Bogotá, [MASK], is an international television telenovela actor."
1063,Jorge Enrique Abello,[X] is [Y] citizen .,Colombia,"Jorge Enrique Abello, born February 28, 1968 Bogotá, [MASK], is an international television telenovela actor."
1064,Charles VI of France,[X] is [Y] citizen .,France,Her parents were King Charles VI of [MASK] and Isabeau of Bavaria.
1065,Charles VI of France,[X] is [Y] citizen .,France,"The marmousets (referred to as les petites gens) is a nickname, first recorded in the chronicles of Jean Froissart, for a group of counselors to Charles VI of [MASK]."
1066,Chittadhar Hridaya,[X] is [Y] citizen .,Nepal,"Kansakar was the guru and inspiration of Chittadhar Hridaya, one of the greatest literary figures of 20th-century [MASK]."
1067,Chittadhar Hridaya,[X] is [Y] citizen .,Nepal,"Sugata Saurabha (Devanagari: सुगत सौरभ) is an epic poem in Nepal Bhasa by Chittadhar Hridaya (1906 – 1982), one of the greatest literary figures from [MASK] in the 20th century."
1068,Giovanni Lista,[X] is [Y] citizen .,Italy,"Giovanni Lista is an Italian art historian and art critic born in [MASK] on February 13, 1943 at Castiglione del Lago (Perugia) and now living in Paris."
1069,Giovanni Lista,[X] is [Y] citizen .,Italy,"Giovanni Lista is an Italian art historian and art critic born in [MASK] on February 13, 1943 at Castiglione del Lago (Perugia) and now living in Paris."
1070,Ike Ekweremadu,[X] is [Y] citizen .,Nigeria,Ike Ekweremadu is a Nigerian politician and lawyer from Enugu State who has served in the Senate of [MASK] since May 2003.
1071,Ike Ekweremadu,[X] is [Y] citizen .,Nigeria,Ike Ekweremadu is a Nigerian politician and lawyer from Enugu State who has served in the Senate of [MASK] since May 2003.
1072,Gert Steegmans,[X] is [Y] citizen .,Belgium,Gert Steegmans (born 30 September 1980 in Hasselt) is a [MASK] former professional road bicycle racer who last rode for UCI ProTeam Trek–Segafredo.
1073,Gert Steegmans,[X] is [Y] citizen .,Belgium,Gert Steegmans (born 30 September 1980 in Hasselt) is a [MASK] former professional road bicycle racer who last rode for UCI ProTeam Trek–Segafredo.
1074,Michel Aoun,[X] is [Y] citizen .,Lebanon,He was on the list of the alliance between the Free Patriotic Movement of general Michel Aoun and former [MASK] Deputy Prime Minister Michel Murr.
1075,Michel Aoun,[X] is [Y] citizen .,Lebanon,It was instigated after General Michel Aoun's defeat by the Syrian army that took control of most of [MASK]'s territory.
1076,Gary Estrada,[X] is [Y] citizen .,Philippines,"Gary Jason B. Ejercito, better known as Gary Estrada, (born May 16, 1971) is a prolific television and movie actor in the [MASK]."
1077,Gary Estrada,[X] is [Y] citizen .,Philippines,"Gary Jason B. Ejercito, better known as Gary Estrada, (born May 16, 1971) is a prolific television and movie actor in the [MASK]."
1078,Arihito Muramatsu,[X] is [Y] citizen .,Japan,"Arihito Muramatsu (村松 有人, born December 12, 1972) is a former professional baseball player from Kanazawa, Ishikawa, [MASK]."
1079,Arihito Muramatsu,[X] is [Y] citizen .,Japan,"Arihito Muramatsu (村松 有人, born December 12, 1972) is a former professional baseball player from Kanazawa, Ishikawa, [MASK]."
1080,Athanasia Tsoumeleka,[X] is [Y] citizen .,Greece,"Among the nation's medalists were track hurdler Fani Halkia, race walker Athanasia Tsoumeleka, teenage judoka Ilias Iliadis, and diving duo Thomas Bimis and Nikolaos Siranidis, who won [MASK]'s first ever Olympic gold medals in their respective disciplines."
1081,Athanasia Tsoumeleka,[X] is [Y] citizen .,Greece,"Xinou represented [MASK] at the 2008 Summer Olympics in Beijing, where she competed for the women's 20 km race walk, along with her compatriots Despina Zapounidou and Athanasia Tsoumeleka, who later disqualified from the event because of doping charges."
1082,Ahmed Ouyahia,[X] is [Y] citizen .,Algeria,"Ahmed Ouyahia (Arabic: أحمد أويحيى) (born 2 July 1952) is an Algerian politician who was Prime Minister of [MASK] from 1995 to 1998, from 2003 to 2006, and from 2008 to 2012."
1083,Ahmed Ouyahia,[X] is [Y] citizen .,Algeria,"Ahmed Ouyahia (Arabic: أحمد أويحيى) (born 2 July 1952) is an Algerian politician who was Prime Minister of [MASK] from 1995 to 1998, from 2003 to 2006, and from 2008 to 2012."
1084,Sally Seltmann,[X] is [Y] citizen .,Australia,During 2007 Paul Kelly performed the track as a duet with his support act New Buffalo (aka Sally Seltmann) on his Stolen Apples Tour of [MASK].
1085,Sally Seltmann,[X] is [Y] citizen .,Australia,During 2007 Paul Kelly performed the track as a duet with his support act New Buffalo (aka Sally Seltmann) on his Stolen Apples Tour of [MASK].
1086,Mike Candys,[X] is [Y] citizen .,Switzerland,"""One Night in Ibiza"" is a song by [MASK] DJ and producer Mike Candys and Evelyn."
1087,Mike Candys,[X] is [Y] citizen .,Switzerland,"It has exclusive contracts with a number of [MASK] artists such as Florian Ast und Francine Jordi, DJ Antoine, Bastian Baker, Remady and Mike Candys."
1088,Ernesto Tornquist,[X] is [Y] citizen .,Argentina,"Tornquist Partido is a partido located in the south west of Buenos Aires Province in [MASK] and is named after Ernesto Tornquist, founder of Tornquist, the partido's main city."
1089,Ernesto Tornquist,[X] is [Y] citizen .,Argentina,"The club, built next to the Tigre Hotel (demolished in 1940), was financed by Ernesto Tornquist and was designed by the architects Pablo Pater, Luis Dubois and the engineer Emilio Mitre (son of the former President of [MASK], Bartolomé Mitre); it was opened on 13 January 1912."
1090,Bert De Graeve,[X] is [Y] citizen .,Belgium,"Bert De Graeve (born 1955, Avelgem) is a [MASK] businessman and since 20 May 2006 Chief Executive Officer (CEO) and Chairman of Bekaert, where he succeeded Julien De Wilde."
1091,Bert De Graeve,[X] is [Y] citizen .,Belgium,"Bert De Graeve (born 1955, Avelgem) is a [MASK] businessman and since 20 May 2006 Chief Executive Officer (CEO) and Chairman of Bekaert, where he succeeded Julien De Wilde."
1092,Jaicko,[X] is [Y] citizen .,Barbados,Jaicko is a [MASK] contemporary pop music singer/songwriter signed to Capitol Records.
1093,Jaicko,[X] is [Y] citizen .,Barbados,"Prior to signing with Capitol Records, Jaicko released a rap solo album independently in [MASK] in November 2006, selling 6,000 copies without major distribution."
1094,Henryk Sienkiewicz,[X] is [Y] citizen .,Poland,"While in Vienna, he illustrated the epic novel The Deluge (Potop) by [MASK] Nobel Prize-winning novelist Henryk Sienkiewicz."
1095,Henryk Sienkiewicz,[X] is [Y] citizen .,Poland,"The classic Polish realist writers regarded Kraszewski as their forerunner and mentor, however as a novelist writing about the history of [MASK], Kraszewski is generally regarded as second only to the Nobel Prize winner Henryk Sienkiewicz."
1096,Miguel Duhamel,[X] is [Y] citizen .,Canada,"Yvon Duhamel (born October 17, 1939 in Montreal, Quebec, [MASK]) is a French-Canadian professional motorcycle racer and father of former AMA Superbike road racer Miguel Duhamel."
1097,Miguel Duhamel,[X] is [Y] citizen .,Canada,"Four non-Americans won the title – Englishman Reg Pridmore, Australians Mat Mladin and Troy Corser, and [MASK] Miguel Duhamel."
1098,"Arthur, Prince of Wales",[X] is [Y] citizen .,England,"Its provisions accomplished three goals: the establishment of a common policy for the two countries regarding France, the reduction of tariffs between the two countries, and, most centrally, the arrangement of a marriage contract between Arthur Tudor, eldest son of Henry VII of [MASK], and Catherine of Aragon, daughter of Isabella I of Castile and Ferdinand II of Aragon."
1099,"Arthur, Prince of Wales",[X] is [Y] citizen .,England,"Arthur Tudor (20 September 1486 – 2 April 1502) was Prince of Wales, Earl of Chester and Duke of Cornwall as the eldest son and heir apparent of Henry VII of [MASK]."
1100,Mimi Heinrich,[X] is [Y] citizen .,Denmark,Mimi Heinrich (born 1 November 1936) is [MASK] actress and writer.
1101,Mimi Heinrich,[X] is [Y] citizen .,Denmark,Mimi Heinrich (born 1 November 1936) is [MASK] actress and writer.
1102,Behar Shtylla,[X] is [Y] citizen .,Albania,"Behar Shtylla (1918 in Korçë – 1994 in Tirana) was an Albanian diplomat, member of the Central Committee of the Party of Labour of [MASK] and Minister of Foreign Affairs from 1953 to 1966."
1103,Behar Shtylla,[X] is [Y] citizen .,Albania,"Behar Shtylla (1918 in Korçë – 1994 in Tirana) was an Albanian diplomat, member of the Central Committee of the Party of Labour of [MASK] and Minister of Foreign Affairs from 1953 to 1966."
1104,Pierre Daye,[X] is [Y] citizen .,Belgium,"Pierre Daye (1892 in Schaerbeek – 1960 in Buenos Aires) was a [MASK] Nazi collaborator and follower of Rexism, who exiled himself to Juan Peron's Argentina after World War II."
1105,Pierre Daye,[X] is [Y] citizen .,Belgium,"Pierre Daye (1892 in Schaerbeek – 1960 in Buenos Aires) was a [MASK] Nazi collaborator and follower of Rexism, who exiled himself to Juan Peron's Argentina after World War II."
1106,Paul Gustav Fischer,[X] is [Y] citizen .,Denmark,Paul Gustav Fischer (22 July 1860 in Copenhagen – 1 May 1934 in Gentofte) was a [MASK] painter.
1107,Paul Gustav Fischer,[X] is [Y] citizen .,Denmark,Paul Fischer belongs to the fourth generation of Fischers to live in [MASK].
1108,Yoshitsugu Matsuoka,[X] is [Y] citizen .,Japan,"Yoshitsugu Matsuoka (松岡 禎丞 Matsuoka Yoshitsugu, born September 17, 1986) is a Japanese voice actor from Hokkaido, [MASK]."
1109,Yoshitsugu Matsuoka,[X] is [Y] citizen .,Japan,"Yoshitsugu Matsuoka (松岡 禎丞 Matsuoka Yoshitsugu, born September 17, 1986) is a Japanese voice actor from Hokkaido, [MASK]."
1110,Takashi Nakamura,[X] is [Y] citizen .,Japan,"The Adventures of Peter Pan (ピーターパンの冒険 Pītā Pan no Bōken) is an anime series by Nippon Animation, directed by Takashi Nakamura and Yoshio Kuroda, which first aired in [MASK] on Fuji Television between January 15, 1989 and December 24, 1989."
1111,Takashi Nakamura,[X] is [Y] citizen .,Japan,"Neko no Kuni Baniparu Uitto), known outside [MASK] as Catnapped!, is a 1995 Japanese anime feature film, directed, created and written by Takashi Nakamura, who was also its character designer."
1112,Luigi Snozzi,[X] is [Y] citizen .,Switzerland,"Luigi Snozzi (born July 29, 1932 in Mendrisio) is a [MASK] architect from Ticino."
1113,Luigi Snozzi,[X] is [Y] citizen .,Switzerland,"Luigi Snozzi (born July 29, 1932 in Mendrisio) is a [MASK] architect from Ticino."
1114,Mel Charles,[X] is [Y] citizen .,Wales,He is the son of ex-footballer Mel Charles and nephew of [MASK] striker John Charles.
1115,Mel Charles,[X] is [Y] citizen .,Wales,"His brother, Mel Charles and nephew Jeremy Charles, also represented [MASK]."
1116,Matt Brouwer,[X] is [Y] citizen .,Canada,"Matt Brouwer is a [MASK] singer/songwriter who got his start in the music industry while studying music at school in Alberta, Canada."
1117,Matt Brouwer,[X] is [Y] citizen .,Canada,"Matt Brouwer is a Canadian singer/songwriter who got his start in the music industry while studying music at school in Alberta, [MASK]."
1118,Robert Persons,[X] is [Y] citizen .,England,"Initially founded in 1593 by Father Robert Parsons SJ as the College of Saint-Omer in Artois, France (then part of the Spanish Netherlands), the school was forced to relocate twice due to the suppression of the Jesuit order, first to Bruges in 1762 and then Liège in 1773, before migrating a third and final time to Stonyhurst in [MASK] where it became Stonyhurst College in 1794."
1119,Robert Persons,[X] is [Y] citizen .,England,"The college was founded in 1593 by Father Robert Persons SJ at St Omer, at a time when penal laws prohibited Catholic education in [MASK]."
1120,Kinji Fukasaku,[X] is [Y] citizen .,Japan,"Yakuza Graveyard, known in [MASK] as Yakuza no Hakaba: Kuchinashi no Hana (やくざの墓場くちなしの花, ""Yakuza Burial: Jasmine Flower""), is a 1976 Japanese yakuza film directed by Kinji Fukasaku."
1121,Kinji Fukasaku,[X] is [Y] citizen .,Japan,"Street Mobster, known in [MASK] as Gendai Yakuza: Hitokiri Yota (現代やくざ人斬り与太), is a 1972 Japanese yakuza film directed by Kinji Fukasaku and starring Bunta Sugawara and Noboru Ando."
1122,David Malangi,[X] is [Y] citizen .,Australia,In July 2004 an exhibition opened of David Malangi's work at the National Gallery of [MASK] called No Ordinary Place.
1123,David Malangi,[X] is [Y] citizen .,Australia,In July 2004 an exhibition opened of David Malangi's work at the National Gallery of [MASK] called No Ordinary Place.
1124,Tebey,[X] is [Y] citizen .,Canada,Two is the second studio album by [MASK] country music artist Tebey.
1125,Tebey,[X] is [Y] citizen .,Canada,The Wait is the debut album by [MASK] country music artist Tebey.
1126,Brad Gushue,[X] is [Y] citizen .,Canada,[MASK]'s Brad Gushue rink defeated Norway's Thomas Ulsrud rink in the final 6-3.
1127,Brad Gushue,[X] is [Y] citizen .,Canada,"The event will feature one team from every country that will send a team to the men's Olympic event, except [MASK], which will have five teams (the four teams that have already qualified for the 2009 Canadian Olympic Curling Trials plus defending Olympic champions, team Brad Gushue."
1128,Kunihiko Yasui,[X] is [Y] citizen .,Japan,"Kunihiko Yasui (安井邦彦 Yasui Kunihiko, born December 12, 1960 in Nagoya, Aichi, [MASK]) is a Japanese voice actor who graduated from the Aichi Prefecture."
1129,Kunihiko Yasui,[X] is [Y] citizen .,Japan,"Kunihiko Yasui (安井邦彦 Yasui Kunihiko, born December 12, 1960 in Nagoya, Aichi, [MASK]) is a Japanese voice actor who graduated from the Aichi Prefecture."
1130,Billy Chow,[X] is [Y] citizen .,Canada,"Billy Chow (born Chow Bei-lei August 24, 1958 in Calgary, Alberta, [MASK]), (also credited as Billy Chau and Billy Chow Bei-lei) is a Canadian-Hong Kong film actor, kickboxer, martial artist, and entrepreneur and is also keen Boxing and Muay thai practitioner."
1131,Billy Chow,[X] is [Y] citizen .,Canada,"Billy Chow (born Chow Bei-lei August 24, 1958 in Calgary, Alberta, [MASK]), (also credited as Billy Chau and Billy Chow Bei-lei) is a Canadian-Hong Kong film actor, kickboxer, martial artist, and entrepreneur and is also keen Boxing and Muay thai practitioner."
1132,Jean Preudhomme,[X] is [Y] citizen .,Switzerland,"He was a contemporary of the [MASK] painters Anton Graff, Jean Preudhomme, Angelica Kauffman, Johann Jakob Schalch, Johann Caspar Füssli and his son Johann Heinrich Füssli."
1133,Jean Preudhomme,[X] is [Y] citizen .,Switzerland,"Jean Preudhomme or Preud'ho(m)me or Prudhomme (baptised on November 23, 1732 in Rolle; buried on July 20, 1795 in La Neuveville) was a [MASK] painter."
1134,David Malouf,[X] is [Y] citizen .,Australia,"She is included in an anthology together with Sir Salman Rushdie, David Malouf, Thomas Keneally, entitled Fear Factor Terror Incognito, edited by Meenakshi Bharat and Sharon Rundle, published by Picador India and [MASK]."
1135,David Malouf,[X] is [Y] citizen .,Australia,"Tipping is represented in many important art collections, including the print collections of The Museum of Modern Art, New York, and the British Museum, London; The National Gallery of [MASK], Canberra; the State Galleries of New South Wales, Victoria, South Australia, Queensland, Tasmania and the Northern Territory; the Powerhouse Museum, Sydney the Museum of Contemporary Art, Sydney; the Powerhouse Centre for the Live Arts, Brisbane; regional art galleries including Lake Macquarie, NSW; Lismore, NSW; Gold Coast, Qld; major libraries including the National Library, Canberra; the Mitchell Library, State Library of NSW; the State Library of Victoria; the State Library of Queensland; and international art collections such as The Kommunication Museum, Frankfurt; the Sackner Archive of Visual Concrete Poetry, Miami; the Beinecker Library, Yale University; the Rare Books Collection, Buffalo University; the Getty Center for the History of Art and the Humanities, Los Angeles, In the 1980s Tipping made documentary films on writers including David Malouf, Randolph Stow, Peter Porter, and Les Murray."
1136,George Pastell,[X] is [Y] citizen .,Cyprus,George Pastell (13 March 1923 - 4 April 1976) was a [MASK] character actor in British films and television programmes.
1137,George Pastell,[X] is [Y] citizen .,Cyprus,George Pastell (13 March 1923 - 4 April 1976) was a [MASK] character actor in British films and television programmes.
1138,Salim Saleh,[X] is [Y] citizen .,Uganda,"General Salim Saleh (born Caleb Akandwanaho, 14 January 1960) is a high-ranking military officer in the [MASK] People's Defence Force, the armed forces of Uganda."
1139,Salim Saleh,[X] is [Y] citizen .,Uganda,"General Salim Saleh (born Caleb Akandwanaho, 14 January 1960) is a high-ranking military officer in the Uganda People's Defence Force, the armed forces of [MASK]."
1140,Narciso Campero,[X] is [Y] citizen .,Bolivia,"Also, Manuel Baquedano assumed command as the new Commander in Chief of the Chilean Army, and the Allied Presidents were thrown out of office and replaced by Nicolas de Pierola in Peru and General Narciso Campero in [MASK]."
1141,Narciso Campero,[X] is [Y] citizen .,Bolivia,"Narciso Campero is a province in the Cochabamba Department, [MASK]."
1142,Alejandro Bustillo,[X] is [Y] citizen .,Argentina,"Alejandro Bustillo (18 March 1889 - 3 November 1982) was an [MASK] painter and architect who left his mark in various tourist destinations in Argentina, especially in the Andean region of the Patagonia."
1143,Alejandro Bustillo,[X] is [Y] citizen .,Argentina,"Alejandro Bustillo (18 March 1889 - 3 November 1982) was an Argentine painter and architect who left his mark in various tourist destinations in [MASK], especially in the Andean region of the Patagonia."
1144,Jessy De Smet,[X] is [Y] citizen .,Belgium,"Jessy De Smet, whose stage name is Jessy (born 8 July 1976, Zottegem, [MASK]), is a Belgian dance music singer of Flemish origin."
1145,Jessy De Smet,[X] is [Y] citizen .,Belgium,"Jessy De Smet, whose stage name is Jessy (born 8 July 1976, Zottegem, Belgium), is a [MASK] dance music singer of Flemish origin."
1146,Florent Brard,[X] is [Y] citizen .,France,"Florent Brard (born 7 February 1976, Chambray-lès-Tours, [MASK]) is a retired French road bicycle racer."
1147,Florent Brard,[X] is [Y] citizen .,France,"Florent Brard (born 7 February 1976, Chambray-lès-Tours, France) is a retired [MASK] road bicycle racer."
1148,Abdelhak Achik,[X] is [Y] citizen .,Morocco,"Abdelhak Achik (born March 11, 1959) is a former [MASK] amateur boxer, who won the bronze medal in the men's featherweight (– 57 kg) category at the 1988 Summer Olympics in Seoul."
1149,Abdelhak Achik,[X] is [Y] citizen .,Morocco,"Abdelhak Achik (born March 11, 1959) is a former [MASK] amateur boxer, who won the bronze medal in the men's featherweight (– 57 kg) category at the 1988 Summer Olympics in Seoul."
1150,Marcin Libicki,[X] is [Y] citizen .,Poland,"Marcin Libicki (born February 2, 1939 in Poznań) is a [MASK] politician, former member of the Polish parliament (Sejm), elected for the Poznań constituency."
