,sub_label,template,obj_label,masked_sentence
683,Tanka Prasad Acharya,[X] is [Y] citizen .,Nepal,Tanka Prasad Acharya (Nepali: टंक प्रसाद आचार्य; 1912 – 23 April 1992) was the Prime Minister of [MASK] from 27 January 1956 to 26 July 1957 and the founding leader of Nepal Praja Parishad (Nepal People's Council).
684,Joanne Malar,[X] is [Y] citizen .,Canada,The last Pan American Games champion was Joanne Malar of [MASK].
685,Joanne Malar,[X] is [Y] citizen .,Canada,The last Pan American Games champion was Joanne Malar of [MASK].
686,Sisowath of Cambodia,[X] is [Y] citizen .,Cambodia,"Prince Norodom Yuvaneath (born October 17, 1943 in Phnom Penh) is the first son of the late king of [MASK], Norodom Sihanouk and Princess Sisowath Pongsanmoni."
687,Sisowath of Cambodia,[X] is [Y] citizen .,Cambodia,"Sisowath Quay is a historic riverside located in Phnom Penh, [MASK], parallel to Sisowath Boulevard in the Chamkarmon district."
688,Naimee Coleman,[X] is [Y] citizen .,Ireland,"Naimee Coleman is a singer/songwriter from Dundrum, Dublin, [MASK]."
689,Naimee Coleman,[X] is [Y] citizen .,Ireland,"Naimee Coleman is a singer/songwriter from Dundrum, Dublin, [MASK]."
690,Miriam Waddington,[X] is [Y] citizen .,Canada,"The reverse side depicts themes in [MASK] exploration, including a map drawn by Samuel de Champlain and a canoe that would be used in his era, as well as a telecommunications antenna, the RADARSAT-1 satellite and a satellite image of Canada; it also has a quotation from Miriam Waddington's poem ""Jacques Cartier in Toronto""."
691,Miriam Waddington,[X] is [Y] citizen .,Canada,"The reverse side depicts themes in Canadian exploration, including a map drawn by Samuel de Champlain and a canoe that would be used in his era, as well as a telecommunications antenna, the RADARSAT-1 satellite and a satellite image of [MASK]; it also has a quotation from Miriam Waddington's poem ""Jacques Cartier in Toronto""."
692,Ellen Gleditsch,[X] is [Y] citizen .,Norway,Ellen Gleditsch (29 December 1879 – 5 June 1968) was a Norwegian radiochemist and [MASK]'s second female professor.
693,Ellen Gleditsch,[X] is [Y] citizen .,Norway,Ellen Gleditsch (29 December 1879 – 5 June 1968) was a Norwegian radiochemist and [MASK]'s second female professor.
694,Shardad Rohani,[X] is [Y] citizen .,Iran,"'Shahrdad Rohani also spelled Shardad Rohani and Shahdad Rohani(Persian: شهرداد روحانی or شهداد روحانی) born May 27, 1954 in Tehran, [MASK] is an Iranian-American composer, violinist/pianist, and conductor."
695,Shardad Rohani,[X] is [Y] citizen .,Iran,"'Shahrdad Rohani also spelled Shardad Rohani and Shahdad Rohani(Persian: شهرداد روحانی or شهداد روحانی) born May 27, 1954 in Tehran, [MASK] is an Iranian-American composer, violinist/pianist, and conductor."
696,Kim Nekroman,[X] is [Y] citizen .,Denmark,"After this release band leader Kim Nekroman relocated to Los Angeles, California while the remaining members, brothers Peter and Kristian Sandorff, remained in [MASK]."
697,Kim Nekroman,[X] is [Y] citizen .,Denmark,"Prior to this release band leader Kim Nekroman had relocated to Los Angeles, California while the Sandorff brothers remained in [MASK]."
698,Paolo Chiavenna,[X] is [Y] citizen .,Italy,Paolo Chiavenna is an [MASK] astronomer who is active at the Sormano Astronomical Observatory in the north Italian province of Como.
699,Paolo Chiavenna,[X] is [Y] citizen .,Italy,Paolo Chiavenna is an [MASK] astronomer who is active at the Sormano Astronomical Observatory in the north Italian province of Como.
700,Tomoko Kawase,[X] is [Y] citizen .,Japan,Tommy heavenly6 peaked at #4 on the Oricon albums chart and is certified Gold by the Recording Industry Association of [MASK].
701,Tomoko Kawase,[X] is [Y] citizen .,Japan,"Kawase Station (河瀬駅 Kawase-eki) is a train station in Hikone, Shiga, [MASK]."
702,Josetsu,[X] is [Y] citizen .,Japan,"Taizō-in holds one of [MASK]'s oldest ink paintings, Catching catfish with a gourd (紙本墨画淡彩瓢鮎図 shihon bokuga tansai hyōnenzu), c.1413, by Josetsu (如拙), which is a National Treasure of Japan."
703,Josetsu,[X] is [Y] citizen .,Japan,"Taizō-in holds one of Japan's oldest ink paintings, Catching catfish with a gourd (紙本墨画淡彩瓢鮎図 shihon bokuga tansai hyōnenzu), c.1413, by Josetsu (如拙), which is a National Treasure of [MASK]."
704,Kanna Arihara,[X] is [Y] citizen .,Japan,"Kanna Arihara (有原 栞菜 Arihara Kanna, born June 15, 1993 in Yokohama, Kanagawa, [MASK]) is a former Japanese pop singer and former member of Cute.Currently she is a talent and fashion model."
705,Kanna Arihara,[X] is [Y] citizen .,Japan,"Kanna Arihara (有原 栞菜 Arihara Kanna, born June 15, 1993 in Yokohama, Kanagawa, [MASK]) is a former Japanese pop singer and former member of Cute.Currently she is a talent and fashion model."
706,John Stanley Beard,[X] is [Y] citizen .,Australia,"Recognised as a bioregion under the Interim Biogeographic Regionalisation for [MASK] (IBRA), it was first defined by John Stanley Beard in 1980."
707,John Stanley Beard,[X] is [Y] citizen .,Australia,"Recognised as a region under the Interim Biogeographic Regionalisation for [MASK] (IBRA), it was first defined by John Stanley Beard in 1980."
708,Alice Furlong,[X] is [Y] citizen .,Ireland,"Alice Furlong (26 November 1866 – 1946) was an Irish writer, poet and political activist who also worked on Irish publications with Douglas Hyde (later President of [MASK])."
709,Alice Furlong,[X] is [Y] citizen .,Ireland,"Alice Furlong (26 November 1866 – 1946) was an Irish writer, poet and political activist who also worked on Irish publications with Douglas Hyde (later President of [MASK])."
710,Yoko Moriguchi,[X] is [Y] citizen .,Japan,"Yoko Moriguchi (森口 瑤子 Moriguchi Yōko, born 5 August 1966 in Tokyo, [MASK]) is a Japanese actress."
711,Yoko Moriguchi,[X] is [Y] citizen .,Japan,"Yoko Moriguchi (森口 瑤子 Moriguchi Yōko, born 5 August 1966 in Tokyo, [MASK]) is a Japanese actress."
712,Espen Knutsen,[X] is [Y] citizen .,Norway,"Kjell Espen Knutsen Jahre (born January 12, 1972) is a retired [MASK] professional ice hockey player and currently the head coach of Vålerenga in the Norwegian GET-ligaen."
713,Espen Knutsen,[X] is [Y] citizen .,Norway,"Kjell Espen Knutsen Jahre (born January 12, 1972) is a retired Norwegian professional ice hockey player and currently the head coach of Vålerenga in the [MASK] GET-ligaen."
714,Abu al-Hassan al-Kharaqani,[X] is [Y] citizen .,Iran,"He was born in 963 (352 Hijri) from Persian parents in Khorasan in a village called Kharaqan (today located in Semnan province of [MASK], near Bastam) and died in the day of Ashura (10th of Muharram) in 1033 (425 Hijri) He was the disciple of Shaikh Abul-Abbas Qassab Amoli in tariqah but had deep spiritual relation with Bayazid Bastami, a well-known Sufi Master who died almost a century before him but had spoken about the personality and state of Abul Hassan Kharaqani."
715,Abu al-Hassan al-Kharaqani,[X] is [Y] citizen .,Iran,"He was born in 963 (352 Hijri) from Persian parents in Khorasan in a village called Kharaqan (today located in Semnan province of [MASK], near Bastam) and died in the day of Ashura (10th of Muharram) in 1033 (425 Hijri) He was the disciple of Shaikh Abul-Abbas Qassab Amoli in tariqah but had deep spiritual relation with Bayazid Bastami, a well-known Sufi Master who died almost a century before him but had spoken about the personality and state of Abul Hassan Kharaqani."
716,George Manuel,[X] is [Y] citizen .,Canada,"George Manuel, former chief of the National Indian Brotherhood/Assembly of First Nations in [MASK], was first to initiate global communication and coordination amongst indigenous peoples emerging from colonialism."
717,George Manuel,[X] is [Y] citizen .,Canada,"George Manuel, OC (February 21, 1921 – November 15, 1989) was an Aboriginal leader in [MASK]."
718,Pop Shalini,[X] is [Y] citizen .,India,"Shalini Singh, popularly called as Pop Shalini, is a singer from Tamil Nadu, [MASK]."
719,Pop Shalini,[X] is [Y] citizen .,India,"Shalini Singh, popularly called as Pop Shalini, is a singer from Tamil Nadu, [MASK]."
720,Petros Voulgaris,[X] is [Y] citizen .,Greece,"Petros Voulgaris (Greek: Πέτρος Βούλγαρης, 13 September 1884 – 26 November 1957) was a Greek admiral who served briefly as Prime Minister of [MASK] in 1945."
721,Petros Voulgaris,[X] is [Y] citizen .,Greece,"Petros Voulgaris (Greek: Πέτρος Βούλγαρης, 13 September 1884 – 26 November 1957) was a Greek admiral who served briefly as Prime Minister of [MASK] in 1945."
722,Jiddu Krishnamurti,[X] is [Y] citizen .,India,"It is run by the Krishnamurti Foundation, [MASK] (KFI) based on the views on education of philosophical speaker and writer J. Krishnamurti."
723,Jiddu Krishnamurti,[X] is [Y] citizen .,India,"It is run by the Krishnamurti Foundation, [MASK] (KFI) based on the views on education of philosophical speaker and writer J. Krishnamurti."
724,Irma Adlawan,[X] is [Y] citizen .,Philippines,"Irma Adlawan (born March 7, 1962 in Kawit, Cavite, [MASK]) is a Filipino stage, film, and television actress."
725,Irma Adlawan,[X] is [Y] citizen .,Philippines,"Irma Adlawan (born March 7, 1962 in Kawit, Cavite, [MASK]) is a Filipino stage, film, and television actress."
726,Vincent Kenis,[X] is [Y] citizen .,Belgium,Vincent Kenis is a [MASK] musician and record producer.
727,Vincent Kenis,[X] is [Y] citizen .,Belgium,Vincent Kenis is a [MASK] musician and record producer.
728,Shanta Kumar,[X] is [Y] citizen .,India,Shanta Kumar (born 12 September 1934) is a former Chief Minister of Himachal Pradesh and a former minister in Government of [MASK].
729,Shanta Kumar,[X] is [Y] citizen .,India,Shanta Kumar (born 12 September 1934) is a former Chief Minister of Himachal Pradesh and a former minister in Government of [MASK].
730,Priyanka Vadra,[X] is [Y] citizen .,India,"Ottavio's financier son, Massimo Quattrocchi, grew up with Sonia Gandhi's children Rahul and Priyanka Gandhi, who are currently rising through the political hierarchy in [MASK]."
731,Priyanka Vadra,[X] is [Y] citizen .,India,"He was present in [MASK] at the time of his father's Argentina arrest in February 2007, and there is speculation that he may have met Priyanka Vadra around that time."
732,Francis Walsingham,[X] is [Y] citizen .,England,"Charged with piracy in 1577, he was saved from the hangman's noose by Sir Francis Walsingham, becoming a Protestant and a subject of the Queen of [MASK]."
733,Francis Walsingham,[X] is [Y] citizen .,England,"He acted as the personal secretary of Sir Francis Walsingham, the secretary of state to Elizabeth I of [MASK]."
734,Ervin Sotto,[X] is [Y] citizen .,Philippines,"Ervin Sotto (born on July 30, 1981 in Las Piñas City, [MASK]) is a Filipino professional basketball player."
735,Ervin Sotto,[X] is [Y] citizen .,Philippines,"Ervin Sotto (born on July 30, 1981 in Las Piñas City, [MASK]) is a Filipino professional basketball player."
736,Cristina Favre-Moretti,[X] is [Y] citizen .,Switzerland,"Cristina Favre-Moretti, née Moretti (born August 26, 1963), is a [MASK] ski mountaineer, long-distance runner and mountain biker."
737,Cristina Favre-Moretti,[X] is [Y] citizen .,Switzerland,"Cristina Favre-Moretti, née Moretti (born August 26, 1963), is a [MASK] ski mountaineer, long-distance runner and mountain biker."
738,Herman Wilhelm Bissen,[X] is [Y] citizen .,Denmark,"Christian Gottlieb Vilhelm Bissen (5 August 1836 – 20 April 1913) was a [MASK] sculptor, son of Herman Wilhelm Bissen."
739,Herman Wilhelm Bissen,[X] is [Y] citizen .,Denmark,"[citation needed] From 1858 through 1869 he studied at the Royal [MASK] Academy of Fine Arts in Copenhagen under Herman Wilhelm Bissen, acquiring a clear influence from the neoclassical style of Bissen's master Bertel Thorvaldsen."
740,Yves Sente,[X] is [Y] citizen .,Belgium,Yves Sente (born 17 January 1964) is a [MASK] comic book editor and author.
741,Yves Sente,[X] is [Y] citizen .,Belgium,Yves Sente (born 17 January 1964) is a [MASK] comic book editor and author.
742,Sven Delblanc,[X] is [Y] citizen .,Sweden,"Sven Delblanc, born May 26, 1931 in Swan River, Manitoba, Canada, died December 15, 1992 in Sunnersta, Gottsunda Parish, Uppsala, [MASK] was a Swedish author and professor of literature."
743,Sven Delblanc,[X] is [Y] citizen .,Sweden,"Sven Delblanc, born May 26, 1931 in Swan River, Manitoba, Canada, died December 15, 1992 in Sunnersta, Gottsunda Parish, Uppsala, Sweden was a [MASK] author and professor of literature."
744,Andris Piebalgs,[X] is [Y] citizen .,Latvia,"In October 2004, [MASK] withdrew Ūdre's candidacy, nominating Andris Piebalgs instead of her."
745,Andris Piebalgs,[X] is [Y] citizen .,Latvia,Andris Piebalgs (born 17 September 1957) is a [MASK] politician and diplomat who served as European Commissioner for Development at the European Commission from 2010 until 2014.
746,Haruna Ishola,[X] is [Y] citizen .,Nigeria,"Born in the town of Ijebu-igbo, Haruna Ishola began recording apala numbers in about 1955, and soon became the most popular artist in the genre, and one of the most respected praise singers in [MASK]."
747,Haruna Ishola,[X] is [Y] citizen .,Nigeria,"Born in the town of Ijebu-igbo, Haruna Ishola began recording apala numbers in about 1955, and soon became the most popular artist in the genre, and one of the most respected praise singers in [MASK]."
748,Evstati Stratev,[X] is [Y] citizen .,Bulgaria,"The Hare Census ([MASK]: Преброяване на дивите зайци / Prebroyavane na Divite Zaytsi) is a Bulgarian satiric comedy film released in 1973, directed by Eduard Zahariev, starring Itzhak Fintzi, Nikola Todev, Georgi Rusev, Evstati Stratev, Philip Trifonov and Todor Kolev."
749,Evstati Stratev,[X] is [Y] citizen .,Bulgaria,"The Hare Census (Bulgarian: Преброяване на дивите зайци / Prebroyavane na Divite Zaytsi) is a [MASK] satiric comedy film released in 1973, directed by Eduard Zahariev, starring Itzhak Fintzi, Nikola Todev, Georgi Rusev, Evstati Stratev, Philip Trifonov and Todor Kolev."
750,Lubaina Himid,[X] is [Y] citizen .,Tanzania,"Lubaina Himid (born 1954 in Zanzibar, [MASK]) is a contemporary African artist and Professor of Contemporary Art at the University of Central Lancashire."
751,Lubaina Himid,[X] is [Y] citizen .,Tanzania,"Lubaina Himid (born 1954 in Zanzibar, [MASK]) is a contemporary African artist and Professor of Contemporary Art at the University of Central Lancashire."
752,Jonel Perlea,[X] is [Y] citizen .,Romania,"Born Ionel Perlea to a [MASK] father, Victor Perlea, and a German mother, Margarethe Haberlein, in Ograda, Romania, he moved to Germany with his mother and his brothers after his father died."
753,Jonel Perlea,[X] is [Y] citizen .,Romania,"Born Ionel Perlea to a Romanian father, Victor Perlea, and a German mother, Margarethe Haberlein, in Ograda, [MASK], he moved to Germany with his mother and his brothers after his father died."
754,Armenians in Turkey,[X] is [Y] citizen .,Turkey,"As editor-in-chief of the bilingual Turkish-Armenian newspaper Agos, Dink was a prominent member of the Armenian minority in [MASK]."
755,Armenians in Turkey,[X] is [Y] citizen .,Turkey,"As editor-in-chief of the bilingual Turkish-Armenian newspaper Agos, Dink was a prominent member of the Armenian minority in [MASK]."
756,Elizabeth I of England,[X] is [Y] citizen .,England,"The two countries had shared a monarch since the Union of the Crowns in 1603, when King James VI of Scotland inherited the [MASK] throne from his double first cousin twice removed, Queen Elizabeth I. Although described as a Union of Crowns, until 1707 there were in fact two separate Crowns resting on the same head (as opposed to the implied creation of a single Crown and a single Kingdom, exemplified by the later Kingdom of Great Britain)."
757,Elizabeth I of England,[X] is [Y] citizen .,England,Elizabeth I (7 September 1533 – 24 March 1603) was Queen of [MASK] and Ireland from 17 November 1558 until her death.
758,Arthur Calwell,[X] is [Y] citizen .,Australia,"The incumbent Liberal Party of [MASK], led by Prime Minister of Australia Harold Holt, with coalition partner the Country Party, led by John McEwen, was elected to an eighth term in government, defeating the Australian Labor Party led by Arthur Calwell."
759,Arthur Calwell,[X] is [Y] citizen .,Australia,"The incumbent Liberal Party of Australia, led by Prime Minister of [MASK] Harold Holt, with coalition partner the Country Party, led by John McEwen, was elected to an eighth term in government, defeating the Australian Labor Party led by Arthur Calwell."
760,Hulagu Khan,[X] is [Y] citizen .,Mongolia,This was blamed on the sudden death of the then-Khagan Möngke Khan; an event that forced the Mongol Ilkhanate Hulagu Khan to take a large part of his army back with him on the way to [MASK].
761,Hulagu Khan,[X] is [Y] citizen .,Mongolia,"After the death of his brother the Great Khan Möngke, Ariq Böke claimed the title of the Great Khan of the Mongol Empire and briefly took power while his brothers Kublai (more commonly known as Kublai Khan) and Hulagu (more commonly known as Hulagu Khan) were absent from [MASK] homeland."
762,Peter Peter,[X] is [Y] citizen .,Denmark,"As part of the project ""Film og musik live"", Christian Rønn has performed live scores to silent films like Metropolis and The Battleship Potemkin, the latter with the [MASK] guitarist Peter Peter (Peter Schneidermann)."
763,Peter Peter,[X] is [Y] citizen .,Denmark,"Peter Schneidermann better known as Peter Peter (born 12 August 1960) is a [MASK] rock musician and former member of the Danish rock band Sort Sol (formerly SODS), before engaging on his own musical projects Bleeder and The Bleeder Group."
764,Camille Bulcke,[X] is [Y] citizen .,India,"Camille Bulcke (1 September 1909 – 17 August 1982) was a Belgian Jesuit missionary in [MASK], who attained pre-eminence in the Hindi language and came to be known as ""India's most famous Christian Hindi scholar""."
765,Camille Bulcke,[X] is [Y] citizen .,India,"Camille Bulcke (1 September 1909 – 17 August 1982) was a Belgian Jesuit missionary in India, who attained pre-eminence in the Hindi language and came to be known as ""[MASK]'s most famous Christian Hindi scholar""."
766,Alfred Gusenbauer,[X] is [Y] citizen .,Austria,Alfred Gusenbauer (born 8 February 1960) is an Austrian politician who until 2008 spent his entire professional life as an employee of the Social Democratic Party of [MASK] (SPÖ) or as a parliamentary representative.
767,Alfred Gusenbauer,[X] is [Y] citizen .,Austria,Alfred Gusenbauer (born 8 February 1960) is an Austrian politician who until 2008 spent his entire professional life as an employee of the Social Democratic Party of [MASK] (SPÖ) or as a parliamentary representative.
768,Tzeni Karezi,[X] is [Y] citizen .,Greece,"Rantevou stin Kerkyra or Rendez-vous stin Kerkira ([MASK]: Ραντεβού στην Κέρκυρα, Conversations in Corfu) is a 1960 Greek black and white drama film directed and written by Dimitris Dadiras and starring Tzeni Karezi."
769,Tzeni Karezi,[X] is [Y] citizen .,Greece,"Rantevou stin Kerkyra or Rendez-vous stin Kerkira (Greek: Ραντεβού στην Κέρκυρα, Conversations in Corfu) is a 1960 [MASK] black and white drama film directed and written by Dimitris Dadiras and starring Tzeni Karezi."
770,Brenda Asnicar,[X] is [Y] citizen .,Argentina,"Brenda Daniela Asnicar Mendoza (born 17 October 1991) known professionally as Brenda Asnicar is an [MASK] actress, dancer and singer."
771,Brenda Asnicar,[X] is [Y] citizen .,Argentina,"Brenda Daniela Asnicar Mendoza (born 17 October 1991) known professionally as Brenda Asnicar is an [MASK] actress, dancer and singer."
772,Michel de Ghelderode,[X] is [Y] citizen .,Belgium,"Michel de Ghelderode (April 3, 1898 – April 1, 1962) was an avant-garde [MASK] dramatist, writing in French."
773,Michel de Ghelderode,[X] is [Y] citizen .,Belgium,"Michel de Ghelderode (April 3, 1898 – April 1, 1962) was an avant-garde [MASK] dramatist, writing in French."
774,F. S. Platou,[X] is [Y] citizen .,Norway,Frithjof Stoud Platou (21 August 1903 – 12 August 1980) was a [MASK] architect.
775,F. S. Platou,[X] is [Y] citizen .,Norway,Frithjof Stoud Platou (21 August 1903 – 12 August 1980) was a [MASK] architect.
776,Prasanna,[X] is [Y] citizen .,India,"Prasanna Yoga Anjaneyar Temple is a Hindu temple devoted to Hanuman located near Madras Institute of Technology, Chromepet, Chennai, [MASK]."
777,Prasanna,[X] is [Y] citizen .,India,"Prasanna Venkatesa Perumal Temple is a Hindu temple located in the town of Thanjavur in Tamil Nadu, [MASK]."
778,Carlos Slim Domit,[X] is [Y] citizen .,Mexico,"In February 2015, Fancy raised a $20 million Series D strategic funding round which was led by [MASK]'s Carlos Slim Domit and the CCC holding company."
779,Carlos Slim Domit,[X] is [Y] citizen .,Mexico,"In February of 2015, Einhorn's company Fancy raised a $20 million Series D strategic funding round which was led by [MASK]'s Carlos Slim Domit and the CCC holding company."
780,Prudentius,[X] is [Y] citizen .,Spain,Her name is not mentioned by Prudentius in his hymn on the martyrs of [MASK].
781,Prudentius,[X] is [Y] citizen .,Spain,"Aurelius Prudentius Clemens was a Roman Christian poet, born in the Roman province of Tarraconensis (now Northern [MASK]) in 348."
782,Facundo Bagnis,[X] is [Y] citizen .,Argentina,"Argentinians Guido Andreozzi and Facundo Bagnis defeated Colombians Nicolás Barrientos and Carlos Salamanca 7–6(7–5), 7–5 in the final to claim the first gold medal for [MASK] in the tennis competition."
783,Facundo Bagnis,[X] is [Y] citizen .,Argentina,"Argentinian Facundo Bagnis defeated his compatriot Guido Andreozzi 4–6, 6–3, 7–6(7–3) in the final, to claim the second gold medal for [MASK] in the tennis competition."
784,George William Gordon,[X] is [Y] citizen .,Jamaica,"George William Gordon (1820 – 23 October 1865) was a Jamaican businessman, magistrate and politician who was a leading critic of the policies of the governor of [MASK] Edward Eyre."
785,George William Gordon,[X] is [Y] citizen .,Jamaica,"George William Gordon (1820 – 23 October 1865) was a Jamaican businessman, magistrate and politician who was a leading critic of the policies of the governor of [MASK] Edward Eyre."
786,Karl Enderlin,[X] is [Y] citizen .,Switzerland,"Karl Enderlin (born August 1, 1923, died November 11, 2004 in Zürich) was a [MASK] figure skater."
787,Karl Enderlin,[X] is [Y] citizen .,Switzerland,"Karl Enderlin (born August 1, 1923, died November 11, 2004 in Zürich) was a [MASK] figure skater."
788,Evan Dimas Darmono,[X] is [Y] citizen .,Indonesia,Evan Dimas Darmono (born 13 March 1995) is an [MASK] professional footballer who currently plays for Persebaya Surabaya in the Indonesia Super League as a midfielder.
789,Evan Dimas Darmono,[X] is [Y] citizen .,Indonesia,Evan Dimas Darmono (born 13 March 1995) is an [MASK] professional footballer who currently plays for Persebaya Surabaya in the Indonesia Super League as a midfielder.
790,Christophor Araratov,[X] is [Y] citizen .,Armenia,He was promoted to the rank of Major General of the [MASK] army during its fight for independence during and after World War I. Araratov participated in the 1918 battles of Sardarapat and Karakilisa against Turkish invaders.
791,Christophor Araratov,[X] is [Y] citizen .,Armenia,He was promoted to the rank of Major General of the [MASK] army during its fight for independence during and after World War I. Araratov participated in the 1918 battles of Sardarapat and Karakilisa against Turkish invaders.
792,Lukas Ligeti,[X] is [Y] citizen .,Austria,"They were formed in 2007 when Mai Lingani (vocals), Wende K. Blass (guitar), Kurt Dahlke (electronics), and Lukas Ligeti (drummer) created the band for a tour of [MASK]."
793,Lukas Ligeti,[X] is [Y] citizen .,Austria,"Lukas Ligeti (born 13 June 1965, in Vienna, [MASK]) is a composer and percussionist."
794,Daudi Kabaka,[X] is [Y] citizen .,Kenya,Daudi Kabaka (1939-2001) was a singer born in [MASK].
795,Daudi Kabaka,[X] is [Y] citizen .,Kenya,"][citation needed] Daudi Kabaka is also known for his Kenyan classic ""Harambee Harambee"" which largely reflects the aspirations of post-colonial [MASK] to build their nation."
796,Julieta Venegas,[X] is [Y] citizen .,Mexico,[MASK] performers Natalia Lafourcade and Julieta Venegas are the only artists to have won in this category more than once.
797,Julieta Venegas,[X] is [Y] citizen .,Mexico,"Another top album was Julieta Venegas' MTV Unplugged, a seventy-five-minute performance in Mexico City broadcast simultaneously in [MASK], Spain and the United States on June 5, 2008."
798,Bent Hamer,[X] is [Y] citizen .,Norway,"Bent Hamer (born 18 December 1956) is a film director, writer and producer, born in Sandefjord, [MASK] in 1956."
799,Bent Hamer,[X] is [Y] citizen .,Norway,"Bent Hamer (born 18 December 1956) is a film director, writer and producer, born in Sandefjord, [MASK] in 1956."
800,Suryavarman I,[X] is [Y] citizen .,Cambodia,"Phimeanakas (Khmer: ប្រាសាទភិមានអាកាស, Prasat Phimean Akas, 'celestial temple') or Vimeanakas (Khmer: ប្រាសាទវិមានអាកាស, Prasat Vimean Akas) at Angkor, [MASK], is a Hindu temple in the Khleang style, built at the end of the 10th century, during the reign of Rajendravarman (from 941-968), then completed by Suryavarman I:115,135:371 in the shape of a three tier pyramid as a Hindu temple."
